{
  "schemaVersion": 1,
  "poseProofId": "pose-proof-88782028d22a7458",
  "assetId": "poet-five-red-chow-cast-dr-sheathed-focus-v1",
  "characterId": "poet-five-red-chow",
  "poseId": "cast",
  "direction": "down-right",
  "canvas": [256, 256],
  "visualMoment": {
    "consumer": "Poet Cast presentation cue",
    "phase": "action-peak",
    "spriteRole": "readable pre-release focus pose; release and magic remain VFX responsibilities"
  },
  "selectedOption": {
    "optionId": "B",
    "title": "hands gathered at chest",
    "caption": "compact two-paw focus with a stable grounded base",
    "head": {"center": [126, 52], "radius": 29},
    "spine": [[126, 81], [122, 168]],
    "segments": [
      [[125, 105], [89, 139], [123, 145]],
      [[125, 105], [163, 139], [123, 145]],
      [[122, 168], [88, 230]],
      [[122, 168], [157, 230]]
    ],
    "supportPoints": [[88, 230], [157, 230]],
    "contactPoints": [[123, 145]],
    "equipmentAxis": [[88, 176], [172, 116]]
  },
  "selection": {
    "optionId": "B",
    "reviewer": "cty41",
    "reason": "cty41 selected option B for its compact two-paw chest focus, stable grounded base, and compatibility with the fully sheathed dao midpoint grip.",
    "rejectedOptions": [
      {"optionId": "A", "reason": "Single forward guide paw weakened the compact two-paw casting focus."},
      {"optionId": "C", "reason": "Raised-paw silhouette was too tall and introduced a less controlled casting read."}
    ],
    "selectedAt": "2026-09-14T13:00:00+08:00"
  },
  "historicalEvidence": {
    "path": "Tools/artworks/poet_five_red_chow/reviews/poet_cast_dr_three_pose_stick_preview_v03.png",
    "sha256": "857961904deb11d123b4fb4aaccc8926fdfc5393ba6e3be8036d5c4f65350bb6"
  }
}
