{"assetId":"falcon-idle-dr-v1","canvas":[256,256],"characterId":"falcon-idle","direction":"down-right","poseId":"idle","poseProofId":"pose-proof-2b3615bfd7e8f292","schemaVersion":1,"selectedOption":{"caption":"classic standing falcon, level gaze, wings tight to capsule","contactPoints":[],"equipmentAxis":[[128,52],[148,58]],"head":{"center":[128,58],"radius":30},"optionId":"A","segments":[[[128,100],[100,128],[102,168]],[[128,100],[156,128],[154,168]],[[128,188],[118,236]],[[128,188],[138,236]],[[128,188],[150,210]]],"spine":[[128,88],[128,188]],"supportPoints":[[118,236],[138,236]],"title":"alert upright"},"selection":{"optionId":"A","reason":"classic standing falcon idle, level gaze, wings tight; clearest rest silhouette","rejectedOptions":[{"optionId":"B","reason":"too crouched for idle"},{"optionId":"C","reason":"head turn ok but A reads faster at 150px"}],"reviewer":"dev","selectedAt":"2026-09-10T12:00:00Z"},"visualMoment":{"consumer":"Falcon boss / enemy idle cue","phase":"rest","spriteRole":"readable resting peregrine; folded wings, grounded talons, not an attack pose"}}
